{
  "dataset_id": "adf-phase2-qualification-synthetic",
  "expected_totals": {
    "accepted_count": 3,
    "fatal_count": 0,
    "nonblank_record_count": 7,
    "physical_line_count": 7,
    "quarantined_count": 4
  },
  "records": [
    {
      "error_category": "",
      "error_code": "",
      "nonblank_record_number": 1,
      "raw_line_sha256": "8abfb2d19da9fc7e7e6bca5f4dd298c418f2323e2cc29967e02a59ec65e06e58",
      "status": "ACCEPTED"
    },
    {
      "error_category": "",
      "error_code": "",
      "nonblank_record_number": 2,
      "raw_line_sha256": "28d2dceed167a2ebca45aa97792114f7bb63b7334a35db481a03e09ac535d3eb",
      "status": "ACCEPTED"
    },
    {
      "error_category": "",
      "error_code": "",
      "nonblank_record_number": 3,
      "raw_line_sha256": "b057cd131d5ee0d22e5c5ed321516d74885aa4d269e10b3c9bf5b4b6e7646231",
      "status": "ACCEPTED"
    },
    {
      "error_category": "SYNTAX",
      "error_code": "INVALID_JSON",
      "nonblank_record_number": 4,
      "raw_line_sha256": "1ab975a68556c4c0c3cb65a96873d746fbc2f42ac74029627eab4b20ddf6f3f4",
      "status": "QUARANTINED"
    },
    {
      "error_category": "STRUCTURE",
      "error_code": "MISSING_REQUIRED_FIELD",
      "nonblank_record_number": 5,
      "raw_line_sha256": "e6ade9c3c4f1bdb4fc4f65a2ae9b4a2c1a2eaf763aaf402f5e9af2d9cb931219",
      "status": "QUARANTINED"
    },
    {
      "error_category": "SEMANTICS",
      "error_code": "INVALID_TIMESTAMP",
      "nonblank_record_number": 6,
      "raw_line_sha256": "38b513fe2ee0dd6bd2f738ca90fe64340ac27d1d6cfd95f86959ce2ea6e0c7ac",
      "status": "QUARANTINED"
    },
    {
      "error_category": "SEMANTICS",
      "error_code": "CANONICAL_CONTEXT_MISMATCH",
      "nonblank_record_number": 7,
      "raw_line_sha256": "caad6122fc18c3cd3c74f73c23f33e9376ca891e0d5e999c3ed54ed1ae702eb0",
      "status": "QUARANTINED"
    }
  ],
  "schema_version": "0.2.0",
  "source_file_sha256": "1a2085a8c9c709766d8395e2ec5390c9c9ec3d15329bf87ac7cc6569d6fe4e44",
  "source_role": "cases"
}
